CODE,UZ,RU,EN
I_1,Respublika tassarufidagi muassasalari,"Учреждения, находящиеся под контролем республики",Institutions under the control of the republic
I_2,Hududiy boshqaruv tarkibidagi,В территориальном управлении,In territorial administration
I_3,Tuman va shaharlar boshqaruv tarkibidagi,Административное устройство районов и городов,Administrative structure of districts and cities
I_4,Boshqa vazirlik va idoralar tizimi tarkibidagi muassasalar,"Учреждения, входящие в систему других министерств и ведомств",Institutions included in the system of other ministries and departments
I_5,Xususiy tibbiyot muassasalari,Частные медицинские учреждения,Private medical institutions
I_6,Xorijiy sarmoyadorlar ishtirokidagi muassasalar,Организации с участием иностранных инвесторов,Organizations with foreign investors participation